{
    "componentChunkName": "component---src-templates-specification-js",
    "path": "/specs/ecma11/",
    "result": {"data":{"allMdx":{"nodes":[{"body":"var _excluded = [\"components\"];\nfunction _extends() { return _extends = Object.assign ? Object.assign.bind() : function (n) { for (var e = 1; e < arguments.length; e++) { var t = arguments[e]; for (var r in t) ({}).hasOwnProperty.call(t, r) && (n[r] = t[r]); } return n; }, _extends.apply(null, arguments); }\nfunction _objectWithoutProperties(e, t) { if (null == e) return {}; var o, r, i = _objectWithoutPropertiesLoose(e, t); if (Object.getOwnPropertySymbols) { var n = Object.getOwnPropertySymbols(e); for (r = 0; r < n.length; r++) o = n[r], -1 === t.indexOf(o) && {}.propertyIsEnumerable.call(e, o) && (i[o] = e[o]); } return i; }\nfunction _objectWithoutPropertiesLoose(r, e) { if (null == r) return {}; var t = {}; for (var n in r) if ({}.hasOwnProperty.call(r, n)) { if (-1 !== e.indexOf(n)) continue; t[n] = r[n]; } return t; }\n/* @jsxRuntime classic */\n/* @jsx mdx */\n\nvar _frontmatter = {\n  \"pl\": \"JavaScript\",\n  \"name\": \"ECMAScript Language Specification\",\n  \"version\": \"11\",\n  \"sortKey\": 11,\n  \"crossReferenced\": true,\n  \"home\": \"https://www.ecma-international.org/ecma-262/11.0/index.html\",\n  \"baseUrl\": \"https://www.ecma-international.org/ecma-262/11.0/index.html#\",\n  \"sections\": [{\n    \"section\": \"4.2.1\",\n    \"title\": \"Objects\",\n    \"url\": \"sec-objects\"\n  }, {\n    \"section\": \"4.3.5\",\n    \"title\": \"prototype\",\n    \"url\": \"sec-terms-and-definitions-prototype\"\n  }, {\n    \"section\": \"4.3.10\",\n    \"title\": \"undefined value\",\n    \"url\": \"sec-undefined-value\"\n  }, {\n    \"section\": \"4.3.11\",\n    \"title\": \"Undefined type\",\n    \"url\": \"sec-terms-and-definitions-undefined-type\"\n  }, {\n    \"section\": \"4.3.12\",\n    \"title\": \"null value\",\n    \"url\": \"sec-null-value\"\n  }, {\n    \"section\": \"4.3.13\",\n    \"title\": \"Null type\",\n    \"url\": \"sec-terms-and-definitions-null-type\"\n  }, {\n    \"section\": \"5.1\",\n    \"title\": \"Grammar Notation\",\n    \"url\": \"sec-syntactic-and-lexical-grammars\"\n  }, {\n    \"section\": \"6.1\",\n    \"title\": \"ECMAScript Language Types\",\n    \"url\": \"sec-ecmascript-language-types\"\n  }, {\n    \"section\": \"7.3.18\",\n    \"title\": \"LengthOfArrayLike\",\n    \"url\": \"sec-lengthofarraylike\"\n  }, {\n    \"section\": \"8.1\",\n    \"title\": \"Lexical Environments\",\n    \"url\": \"sec-lexical-environments\"\n  }, {\n    \"section\": \"9.1\",\n    \"title\": \"Ordinary Object Internal Methods and Internal Slots\",\n    \"url\": \"sec-ordinary-object-internal-methods-and-internal-slots\"\n  }, {\n    \"section\": \"9.4.4\",\n    \"title\": \"Arguments Exotic Objects\",\n    \"url\": \"sec-arguments-exotic-objects\"\n  }, {\n    \"section\": \"13.3.1\",\n    \"title\": \"Let and Const Declarations\",\n    \"url\": \"sec-let-and-const-declarations\"\n  }, {\n    \"section\": \"11.8\",\n    \"title\": \"Literals\",\n    \"url\": \"sec-ecmascript-language-lexical-grammar-literals\"\n  }, {\n    \"section\": \"11.8.4\",\n    \"title\": \"String Literals\",\n    \"url\": \"sec-string-literals\"\n  }, {\n    \"section\": \"12.1\",\n    \"title\": \"Identifiers\",\n    \"url\": \"sec-identifiers\"\n  }, {\n    \"section\": \"12.2.2\",\n    \"title\": \"The this Keyword\",\n    \"url\": \"sec-this-keyword\"\n  }, {\n    \"section\": \"12.3.2\",\n    \"title\": \"Property Accessors\",\n    \"url\": \"sec-property-accessors\"\n  }, {\n    \"section\": \"12.3.6\",\n    \"title\": \"Function Calls\",\n    \"url\": \"sec-function-calls\"\n  }, {\n    \"section\": \"12.5.5\",\n    \"title\": \"The typeof Operator\",\n    \"url\": \"sec-typeof-operator\"\n  }, {\n    \"section\": \"12.7\",\n    \"title\": \"Multiplicative Operators\",\n    \"url\": \"sec-multiplicative-operators\"\n  }, {\n    \"section\": \"12.10.4\",\n    \"title\": \"IntstanceofOperator (V, target)\",\n    \"url\": \"sec-instanceofoperator\"\n  }, {\n    \"section\": \"12.11\",\n    \"title\": \"Equality Operators\",\n    \"url\": \"sec-equality-operators\"\n  }, {\n    \"section\": \"12.14\",\n    \"title\": \"Conditional Operator\",\n    \"url\": \"sec-conditional-operator\"\n  }, {\n    \"section\": \"12.15.4\",\n    \"title\": \"Runtime semantics evaluation of assignment operators\",\n    \"url\": \"sec-assignment-operators-runtime-semantics-evaluation\"\n  }, {\n    \"section\": \"13.5\",\n    \"title\": \"Expression Statement\",\n    \"url\": \"sec-expression-statement\"\n  }, {\n    \"section\": \"14.1\",\n    \"title\": \"Function Definitions\",\n    \"url\": \"sec-function-definitions\"\n  }, {\n    \"section\": \"14.2\",\n    \"title\": \"Arrow Function Definitions\",\n    \"url\": \"sec-method-definitions\"\n  }, {\n    \"section\": \"14.6\",\n    \"title\": \"Class Definitions\",\n    \"url\": \"sec-class-definitions\"\n  }, {\n    \"section\": \"18\",\n    \"title\": \"The Global Object\",\n    \"url\": \"sec-global-object\"\n  }, {\n    \"section\": \"18.1.1\",\n    \"title\": \"globalThis\",\n    \"url\": \"sec-globalthis\"\n  }, {\n    \"section\": \"19.2.3.1\",\n    \"title\": \"Function.prototype.apply ( thisArg, argArray )\",\n    \"url\": \"sec-function.prototype.apply\"\n  }, {\n    \"section\": \"19.2.3.2\",\n    \"title\": \"Function.prototype.bind ( thisArg, ...args )\",\n    \"url\": \"sec-function.prototype.bind\"\n  }, {\n    \"section\": \"19.2.3.3\",\n    \"title\": \"Function.prototype.call ( thisArg, ...args )\",\n    \"url\": \"sec-function.prototype.call\"\n  }, {\n    \"section\": \"19.2.4\",\n    \"title\": \"Function Instances\",\n    \"url\": \"sec-function-instances\"\n  }, {\n    \"section\": \"19.2.4.2\",\n    \"title\": \"name\",\n    \"url\": \"sec-function-instances-name\"\n  }, {\n    \"section\": \"22.1.3.18\",\n    \"title\": \"Array.prototype.map\",\n    \"url\": \"sec-array.prototype.map\"\n  }]\n};\nvar layoutProps = {\n  _frontmatter: _frontmatter\n};\nvar MDXLayout = \"wrapper\";\nreturn function MDXContent(_ref) {\n  var components = _ref.components,\n    props = _objectWithoutProperties(_ref, _excluded);\n  return mdx(MDXLayout, _extends({}, layoutProps, props, {\n    components: components,\n    mdxType: \"MDXLayout\"\n  }), mdx(\"p\", null, \"The ECMAScript Language Specification is the official, authoritative specification\\nof the JavaScript programming language.\\n\", mdx(\"strong\", {\n    parentName: \"p\"\n  }, \"ECMAScript 11 language specification\"), \" was published in June 2020 and followed the \", mdx(\"a\", {\n    parentName: \"p\",\n    \"href\": \"(/specs/ecma10)\"\n  }, \"ECMAScript 10 language specification\"), \".\"), mdx(\"p\", null, \"This ECMAScript version goes beyond the previous version by specifying features like:\"), mdx(\"ul\", null, mdx(\"li\", {\n    parentName: \"ul\"\n  }, \"Primitive type \", mdx(\"code\", {\n    parentName: \"li\",\n    \"className\": \"language-text\"\n  }, \"BigInt\")), mdx(\"li\", {\n    parentName: \"ul\"\n  }, \"Dynamic imports: imports now return a \", mdx(\"code\", {\n    parentName: \"li\",\n    \"className\": \"language-text\"\n  }, \"Promise\")), mdx(\"li\", {\n    parentName: \"ul\"\n  }, \"The method \", mdx(\"code\", {\n    parentName: \"li\",\n    \"className\": \"language-text\"\n  }, \"Promise.allSettled\")), mdx(\"li\", {\n    parentName: \"ul\"\n  }, \"Standardised \", mdx(\"code\", {\n    parentName: \"li\",\n    \"className\": \"language-text\"\n  }, \"globalThis\")), mdx(\"li\", {\n    parentName: \"ul\"\n  }, \"The nullish coalescing operator \", mdx(\"code\", {\n    parentName: \"li\",\n    \"className\": \"language-text\"\n  }, \"??\")), mdx(\"li\", {\n    parentName: \"ul\"\n  }, \"The optional chaining operator \", mdx(\"code\", {\n    parentName: \"li\",\n    \"className\": \"language-text\"\n  }, \"?.\"))));\n}\n;\nMDXContent.isMDXComponent = true;","frontmatter":{"name":"ECMAScript Language Specification","pl":"JavaScript","version":"11","crossReferenced":true,"home":"https://www.ecma-international.org/ecma-262/11.0/index.html","baseUrl":"https://www.ecma-international.org/ecma-262/11.0/index.html#","sections":[{"section":"4.2.1","title":"Objects","url":"sec-objects"},{"section":"4.3.5","title":"prototype","url":"sec-terms-and-definitions-prototype"},{"section":"4.3.10","title":"undefined value","url":"sec-undefined-value"},{"section":"4.3.11","title":"Undefined type","url":"sec-terms-and-definitions-undefined-type"},{"section":"4.3.12","title":"null value","url":"sec-null-value"},{"section":"4.3.13","title":"Null type","url":"sec-terms-and-definitions-null-type"},{"section":"5.1","title":"Grammar Notation","url":"sec-syntactic-and-lexical-grammars"},{"section":"6.1","title":"ECMAScript Language Types","url":"sec-ecmascript-language-types"},{"section":"7.3.18","title":"LengthOfArrayLike","url":"sec-lengthofarraylike"},{"section":"8.1","title":"Lexical Environments","url":"sec-lexical-environments"},{"section":"9.1","title":"Ordinary Object Internal Methods and Internal Slots","url":"sec-ordinary-object-internal-methods-and-internal-slots"},{"section":"9.4.4","title":"Arguments Exotic Objects","url":"sec-arguments-exotic-objects"},{"section":"13.3.1","title":"Let and Const Declarations","url":"sec-let-and-const-declarations"},{"section":"11.8","title":"Literals","url":"sec-ecmascript-language-lexical-grammar-literals"},{"section":"11.8.4","title":"String Literals","url":"sec-string-literals"},{"section":"12.1","title":"Identifiers","url":"sec-identifiers"},{"section":"12.2.2","title":"The this Keyword","url":"sec-this-keyword"},{"section":"12.3.2","title":"Property Accessors","url":"sec-property-accessors"},{"section":"12.3.6","title":"Function Calls","url":"sec-function-calls"},{"section":"12.5.5","title":"The typeof Operator","url":"sec-typeof-operator"},{"section":"12.7","title":"Multiplicative Operators","url":"sec-multiplicative-operators"},{"section":"12.10.4","title":"IntstanceofOperator (V, target)","url":"sec-instanceofoperator"},{"section":"12.11","title":"Equality Operators","url":"sec-equality-operators"},{"section":"12.14","title":"Conditional Operator","url":"sec-conditional-operator"},{"section":"12.15.4","title":"Runtime semantics evaluation of assignment operators","url":"sec-assignment-operators-runtime-semantics-evaluation"},{"section":"13.5","title":"Expression Statement","url":"sec-expression-statement"},{"section":"14.1","title":"Function Definitions","url":"sec-function-definitions"},{"section":"14.2","title":"Arrow Function Definitions","url":"sec-method-definitions"},{"section":"14.6","title":"Class Definitions","url":"sec-class-definitions"},{"section":"18","title":"The Global Object","url":"sec-global-object"},{"section":"18.1.1","title":"globalThis","url":"sec-globalthis"},{"section":"19.2.3.1","title":"Function.prototype.apply ( thisArg, argArray )","url":"sec-function.prototype.apply"},{"section":"19.2.3.2","title":"Function.prototype.bind ( thisArg, ...args )","url":"sec-function.prototype.bind"},{"section":"19.2.3.3","title":"Function.prototype.call ( thisArg, ...args )","url":"sec-function.prototype.call"},{"section":"19.2.4","title":"Function Instances","url":"sec-function-instances"},{"section":"19.2.4.2","title":"name","url":"sec-function-instances-name"},{"section":"22.1.3.18","title":"Array.prototype.map","url":"sec-array.prototype.map"}]},"parent":{"name":"ecma11"}}]}},"pageContext":{"glob":"**/src/data/specs/ecma11.md"}},
    "staticQueryHashes": ["3649515864","4169798128"]}